"2022/02/08 3:08:56 PM EST","Deutschland","Deutschland","22","Weiblich","Schwarz/Afroamerikaner","Mittlere Reife","Beschäftigt","0€ < Einkommen<= 25.000€","Lebenspartner","Normalerweise fahre ich die Geschwindigkeitsbegrenzung (innerhalb von plus oder minus 10 km/h).","Ich signalisiere JEDE Bewegung (Sie verwenden Ihr Signal zu 100 %)","Ich wechsle die Spur nur, wenn es sein muss.","Sie planen voraus und wechseln die Spur jeweils um eine Spur, wenn Sie eine Öffnung sehen. Sie wechseln selten mehrere Fahrspuren gleichzeitig.","Normalerweise beschleunigen und verlangsamen Sie langsam und es dauert eine Weile, bis Sie auf Geschwindigkeit kommen. Sie vermeiden einen kurzen Stopp.","Selten (Ich überhole Fahrzeuge nur, wenn es unbedingt sein muss)","Fern","Häufig: Jedes Mal, wenn ich Bremslichter oder etwas auf der Straße sehe oder wenn ich ein Risiko wahrnehme, bremse ich.","Normalerweise fahre ich die Geschwindigkeitsbegrenzung (innerhalb von plus oder minus 10 km/h).","Ich signalisiere JEDE Bewegung (Sie verwenden Ihr Signal zu 100 %)","Ich wechsle die Spur nur, wenn es sein muss.","Sie planen voraus und wechseln die Spur jeweils um eine Spur, wenn Sie eine Öffnung sehen. Sie wechseln selten mehrere Fahrspuren gleichzeitig.","Normalerweise beschleunigen und verlangsamen Sie langsam und es dauert eine Weile, bis Sie auf Geschwindigkeit kommen. Sie vermeiden kurze Stopps.","Selten (Ich überhole Fahrzeuge nur, wenn es unbedingt sein muss)","Fern","Häufig: Jedes Mal, wenn ich Bremslichter oder etwas auf der Straße sehe oder wenn ich ein Risiko wahrnehme, bremse ich.","Die rechte Spur","Verlangsamen Sie und versuchen Sie, einen anderen Platz dahinter zu finden.","Ich bremse, um das Fahrzeug vor dem Abbiegen zu verlangsamen, und da meine Geschwindigkeit langsam genug ist, muss ich beim Abbiegen nicht oder nur sehr wenig bremsen.","Ich neige dazu, meine Geschwindigkeit zu reduzieren, um in Kurven auf der Straße nicht ständig auf die Bremse treten zu müssen.","Parken an einer Steigung","Nebel","Ich werde meine Geschwindigkeit verringern, bis die Wetterbedingungen weg sind.","Mein Signalisierungsverhalten bleibt gleich.","Ich wechsle die Spur nur, wenn es sein muss.","Fern","Ich fahre nachts normalerweise schneller (10 km/h oder mehr ÜBER der Geschwindigkeitsbegrenzung)","Ich signalisiere meine Bewegungen oft (Sie verwenden Ihr Signal 75 % der Zeit)","Ich wechsle die Spur nur, wenn es sein muss.","Etwas Vertrauen","Etwas Misstrauen","Etwas Misstrauen","Etwas Misstrauen","Misstrauen","Etwas Vertrauen","Etwas Misstrauen","Etwas Misstrauen","Etwas Misstrauen","Etwas Misstrauen","Etwas Misstrauen","Etwas Misstrauen","Etwas Misstrauen","Etwas Misstrauen","Etwas Misstrauen","Ich ziehe es vor, dass das selbstfahrende Auto eine Geschwindigkeit innerhalb von plus oder minus 10 km/h der Geschwindigkeitsbegrenzung beibehält.","Nur wenn unbedingt nötig","Langsam: Das Auto kann eine Weile brauchen, um auf Geschwindigkeit zu kommen. Das Auto würde einen kurzen Stopp vermeiden.","Manchmal: Ich möchte schnell an mein Ziel kommen, aber ich möchte, dass die Fahrt ruhig und stabil ist.","Selten: Das Auto soll nur dann bremsen, wenn es unbedingt passen muss, ob Stau oder ein Einsatzfahrzeug. Wenn das Auto das Bremsen durch Spurwechsel vermeiden kann, erwarte ich, dass es die Spur wechselt.","Etwas Misstrauen","Etwas Misstrauen","Etwas Misstrauen","Etwas Misstrauen","Etwas Misstrauen","Etwas Misstrauen","Etwas Misstrauen","Etwas Misstrauen","Ich ziehe es vor, dass das selbstfahrende Auto eine Geschwindigkeit von 10 km/h oder mehr UNTER hält","Nur wenn unbedingt nötig","Reibungslos: Solange die Fahrt reibungslos und sicher ist, kann das Auto schnell beschleunigen/verzögern.","Manchmal: Ich möchte schnell an mein Ziel kommen, aber ich möchte, dass die Fahrt ruhig und stabil ist.","Reibungslos: Solange die Fahrt reibungslos und sicher ist, kann das Auto schnell beschleunigen/verzögern."
"2022/02/10 2:23:16 PM EST","Deutschland","Deutschland","23","Männlich","Weiß","Mittlere Reife","Beschäftigt","0€ < Einkommen<= 25.000€","Single, nie verheiratet","Normalerweise fahre ich die Geschwindigkeitsbegrenzung (innerhalb von plus oder minus 10 km/h).","Ich signalisiere meine Bewegungen oft (Sie verwenden Ihr Signal 75 % der Zeit)","Ich wechsle häufig die Spur, um auf der schnellstmöglichen Spur zu sein.","Manchmal wechseln Sie mehrere Fahrspuren gleichzeitig und manchmal planen Sie im Voraus und wechseln die Fahrspuren jeweils eine Spur nach der anderen.","Normalerweise beschleunigen und verlangsamen Sie langsam und es dauert eine Weile, bis Sie auf Geschwindigkeit kommen. Sie vermeiden einen kurzen Stopp.","Oft (ich überhole andere Fahrzeuge in verschiedenen Situationen)","Mittlere Distanz","Selten: Ich bremse nur, wenn es sein muss, zum Beispiel bei Stau oder Einsatzfahrzeugen. Wenn ich das Bremsen durch einen Spurwechsel vermeiden kann, werde ich die Spur wechseln.","Ich fahre normalerweise unter dem Tempolimit (mehr als 10 km/h UNTER dem Tempolimit).","Ich signalisiere manchmal eine Bewegung: (Sie verwenden Ihr Signal in 50 % der Fälle)","Ich wechsle häufig die Spur, um auf der schnellstmöglichen Spur zu sein.","Sie planen voraus und wechseln die Spur jeweils um eine Spur, wenn Sie eine Öffnung sehen. Sie wechseln selten mehrere Fahrspuren gleichzeitig.","Normalerweise beschleunigen und verlangsamen Sie langsam und es dauert eine Weile, bis Sie auf Geschwindigkeit kommen. Sie vermeiden kurze Stopps.","Manchmal (ich überhole andere Fahrzeuge nur in wenigen Situationen)","Fern","Manchmal: Ich bremse, wenn es nötig ist, aber ich versuche, den richtigen Abstand zu den Autos um mich herum zu halten, damit ich nicht jedes Mal bremse, wenn der Verkehr langsamer wird.","Die rechte Spur","Behalten Sie Ihre Geschwindigkeit bei, schließlich wird sich etwas öffnen. Ich plane im Voraus, wenn ich weiß, dass meine Ausfahrt in der Nähe ist, damit ich genügend Zeit habe, um den Spurwechsel vorzunehmen.","Ich halte meine aktuelle Geschwindigkeit und drücke während der Kurve auf die Bremse.","Ich neige dazu, meine Geschwindigkeit zu reduzieren, um in Kurven auf der Straße nicht ständig auf die Bremse treten zu müssen.","Abgewinkeltes Parken","Regen","Insgesamt werde ich meine Geschwindigkeit verringern, aber es kann Momente geben, in denen ich vorübergehend schneller werde.","Ich neige dazu, mehr als gewöhnlich zu signalisieren. Ich kann Blinker oder sogar Handzeichen verwenden","Ich wechsle die Spur nur, wenn es sein muss.","Fern","Ich fahre nachts normalerweise langsamer (10 km/h oder mehr UNTER der Geschwindigkeitsbegrenzung)","Ich signalisiere meine Bewegungen oft (Sie verwenden Ihr Signal 75 % der Zeit)","Ich wechsle die Spur nur, wenn es sein muss.","Etwas Misstrauen","Etwas Misstrauen","Neutral","Etwas Misstrauen","Neutral","Etwas Misstrauen","Neutral","Neutral","Etwas Misstrauen","Neutral","Neutral","Misstrauen","Etwas Misstrauen","Vertrauen","Etwas Misstrauen","Ich ziehe es vor, dass das selbstfahrende Auto eine Geschwindigkeit von 10 km/h oder mehr UNTER der Geschwindigkeitsbegrenzung hält.","Gelegentlich, wenn ein extrem langsames Fahrzeug überholt werden muss.","Reibungslos: Solange die Fahrt reibungslos und sicher ist, kann das Auto schnell beschleunigen/verzögern.","Manchmal: Ich möchte schnell an mein Ziel kommen, aber ich möchte, dass die Fahrt ruhig und stabil ist.","Häufig: Wenn ich Bremslichter, etwas auf der Straße oder ein wahrgenommenes Risiko sehe, erwarte ich, dass das Auto reagiert, und das kann bedeuten, dass ich stark bremsen muss.","Etwas Misstrauen","Neutral","Misstrauen","Neutral","Etwas Misstrauen","Etwas Misstrauen","Etwas Vertrauen","Misstrauen","Ich ziehe es vor, dass das selbstfahrende Auto eine Geschwindigkeit von 10 km/h oder mehr UNTER hält","Nur wenn unbedingt nötig","Langsam: Das Auto kann eine Weile brauchen, um auf Geschwindigkeit zu kommen. Das Auto würde einen kurzen Stopp vermeiden.","Manchmal: Ich möchte schnell an mein Ziel kommen, aber ich möchte, dass die Fahrt ruhig und stabil ist.","Reibungslos: Solange die Fahrt reibungslos und sicher ist, kann das Auto schnell beschleunigen/verzögern."
"2022/02/10 3:17:44 PM EST","Deutschland","Deutschland","38","Weiblich","Weiß","Bachelor-Abschluss","Beschäftigt","50.000€ < Einkommen <= 100.000€","Lebenspartner","Ich fahre normalerweise über dem Tempolimit (mehr als 10 km/h ÜBER dem Tempolimit).","Ich signalisiere JEDE Bewegung (Sie verwenden Ihr Signal zu 100 %)","Ich wechsle häufig die Spur, um auf der schnellstmöglichen Spur zu sein.","Manchmal wechseln Sie mehrere Fahrspuren gleichzeitig und manchmal planen Sie im Voraus und wechseln die Fahrspuren jeweils eine Spur nach der anderen.","Sie beschleunigen und verlangsamen normalerweise in einem moderaten Tempo und kommen relativ schnell auf Geschwindigkeit. Sie halten selten an und die Passagiere fühlen sich beim Fahren nicht vorwärts oder rückwärts geschleudert.","Manchmal (ich überhole andere Fahrzeuge nur in wenigen Situationen)","Mittlere Distanz","Selten: Ich bremse nur, wenn es sein muss, zum Beispiel bei Stau oder Einsatzfahrzeugen. Wenn ich das Bremsen durch einen Spurwechsel vermeiden kann, werde ich die Spur wechseln.","Normalerweise fahre ich die Geschwindigkeitsbegrenzung (innerhalb von plus oder minus 10 km/h).","Ich signalisiere JEDE Bewegung (Sie verwenden Ihr Signal zu 100 %)","Ich wechsle gelegentlich die Spur, um ein extrem langsames Fahrzeug zu überholen.","Manchmal wechseln Sie mehrere Fahrspuren gleichzeitig und manchmal planen Sie im Voraus und wechseln die Fahrspuren jeweils eine Spur nach der anderen.","Sie beschleunigen und verlangsamen normalerweise in einem moderaten Tempo und kommen relativ schnell auf Geschwindigkeit. Sie halten selten an und die Passagiere fühlen sich beim Fahren nicht vorwärts oder rückwärts geschleudert.","Manchmal (ich überhole andere Fahrzeuge nur in wenigen Situationen)","Mittlere Distanz","Selten: Ich bremse nur, wenn es sein muss, zum Beispiel bei Stau oder Einsatzfahrzeugen. Wenn ich das Bremsen durch einen Spurwechsel vermeiden kann, werde ich die Spur wechseln.","Die rechte Spur","Beschleunigen Sie und versuchen Sie, einen anderen Platz voraus zu finden.","Normalerweise beschleunige ich und mache dann die Kurve und muss normalerweise bremsen, während ich die Kurve fahre.","Ich behalte meine Geschwindigkeit bei und verlangsame nicht für eine Kurve auf der Straße. Passagiere könnten sich seitlich geschleudert fühlen.","Parken an einer Steigung","Regen","Ich werde meine Geschwindigkeit verringern, bis die Wetterbedingungen weg sind.","Ich neige dazu, mehr als gewöhnlich zu signalisieren. Ich kann Blinker oder sogar Handzeichen verwenden","Ich wechsle die Spur nur, wenn es sein muss.","Mittlere Distanz","Ich fahre normalerweise nachts mit der Höchstgeschwindigkeit (10 km/h plus oder minus der Höchstgeschwindigkeit)","Ich signalisiere JEDE Bewegung (Sie verwenden Ihr Signal zu 100 %)","Ich wechsle gelegentlich die Spur, um ein extrem langsames Fahrzeug zu überholen.","Etwas Misstrauen","Etwas Misstrauen","Etwas Vertrauen","Misstrauen","Misstrauen","Etwas Misstrauen","Etwas Misstrauen","Misstrauen","Misstrauen","Etwas Vertrauen","Misstrauen","Etwas Misstrauen","Neutral","Vertrauen","Neutral","Ich ziehe es vor, dass das selbstfahrende Auto eine Geschwindigkeit von 10 km/h oder mehr UNTER der Geschwindigkeitsbegrenzung hält.","Nur wenn unbedingt nötig","Langsam: Das Auto kann eine Weile brauchen, um auf Geschwindigkeit zu kommen. Das Auto würde einen kurzen Stopp vermeiden.","Selten: nur wenn das Auto unbedingt muss.","Häufig: Wenn ich Bremslichter, etwas auf der Straße oder ein wahrgenommenes Risiko sehe, erwarte ich, dass das Auto reagiert, und das kann bedeuten, dass ich stark bremsen muss.","Misstrauen","Misstrauen","Etwas Vertrauen","Misstrauen","Etwas Misstrauen","Misstrauen","Etwas Vertrauen","Misstrauen","Ich ziehe es vor, dass das selbstfahrende Auto eine Geschwindigkeit von 10 km/h oder mehr UNTER hält","Nur wenn unbedingt nötig","Langsam: Das Auto kann eine Weile brauchen, um auf Geschwindigkeit zu kommen. Das Auto würde einen kurzen Stopp vermeiden.","Selten: nur wenn das Auto unbedingt muss.","Häufig: Wenn ich Bremslichter, etwas auf der Straße oder ein wahrgenommenes Risiko sehe, erwarte ich, dass das Auto reagiert, und das kann bedeuten, dass ich stark bremsen muss."
"2022/02/10 8:08:06 PM EST","Deutschland","Deutschland","31","Weiblich","Weiß","MD/Andere Berufsabschlüsse","Arbeitslos","No income","Single, nie verheiratet","Normalerweise fahre ich die Geschwindigkeitsbegrenzung (innerhalb von plus oder minus 10 km/h).","Ich signalisiere manchmal eine Bewegung: (Sie verwenden Ihr Signal in 50 % der Fälle)","Ich wechsle die Spur nur, wenn es sein muss.","Manchmal wechseln Sie mehrere Fahrspuren gleichzeitig und manchmal planen Sie im Voraus und wechseln die Fahrspuren jeweils eine Spur nach der anderen.","Sie beschleunigen und verlangsamen normalerweise in einem moderaten Tempo und kommen relativ schnell auf Geschwindigkeit. Sie halten selten an und die Passagiere fühlen sich beim Fahren nicht vorwärts oder rückwärts geschleudert.","Manchmal (ich überhole andere Fahrzeuge nur in wenigen Situationen)","Mittlere Distanz","Manchmal: Ich bremse, wenn es nötig ist, aber ich versuche, den richtigen Abstand zu den Autos um mich herum zu halten, damit ich nicht jedes Mal bremse, wenn der Verkehr langsamer wird.","Normalerweise fahre ich die Geschwindigkeitsbegrenzung (innerhalb von plus oder minus 10 km/h).","Ich signalisiere JEDE Bewegung (Sie verwenden Ihr Signal zu 100 %)","Ich wechsle gelegentlich die Spur, um ein extrem langsames Fahrzeug zu überholen.","Sie planen voraus und wechseln die Spur jeweils um eine Spur, wenn Sie eine Öffnung sehen. Sie wechseln selten mehrere Fahrspuren gleichzeitig.","Sie beschleunigen und verlangsamen normalerweise in einem moderaten Tempo und kommen relativ schnell auf Geschwindigkeit. Sie halten selten an und die Passagiere fühlen sich beim Fahren nicht vorwärts oder rückwärts geschleudert.","Oft (ich überhole andere Fahrzeuge in verschiedenen Situationen)","Fern","Manchmal: Ich bremse, wenn es nötig ist, aber ich versuche, den richtigen Abstand zu den Autos um mich herum zu halten, damit ich nicht jedes Mal bremse, wenn der Verkehr langsamer wird.","Die rechte Spur","Verlangsamen Sie und versuchen Sie, einen anderen Platz dahinter zu finden.","Ich bremse, um das Fahrzeug vor dem Abbiegen zu verlangsamen, und da meine Geschwindigkeit langsam genug ist, muss ich beim Abbiegen nicht oder nur sehr wenig bremsen.","Ich behalte meine Geschwindigkeit bei und wenn ich für eine Kurve auf der Straße langsamer werden muss, werde ich das tun.","Parken an einer Steigung","Nebel","Ich werde meine Geschwindigkeit verringern, bis die Wetterbedingungen weg sind.","Mein Signalisierungsverhalten bleibt gleich.","Ich wechsle die Spur nur, wenn es sein muss.","Mittlere Distanz","Ich fahre nachts normalerweise langsamer (10 km/h oder mehr UNTER der Geschwindigkeitsbegrenzung)","Ich signalisiere JEDE Bewegung (Sie verwenden Ihr Signal zu 100 %)","Ich wechsle die Spur nur, wenn es sein muss.","Neutral","Etwas Vertrauen","Neutral","Etwas Misstrauen","Neutral","Etwas Vertrauen","Etwas Misstrauen","Etwas Vertrauen","Etwas Misstrauen","Etwas Vertrauen","Etwas Misstrauen","Etwas Vertrauen","Etwas Vertrauen","Etwas Vertrauen","Etwas Vertrauen","Ich ziehe es vor, dass das selbstfahrende Auto eine Geschwindigkeit innerhalb von plus oder minus 10 km/h der Geschwindigkeitsbegrenzung beibehält.","Gelegentlich, wenn ein extrem langsames Fahrzeug überholt werden muss.","Reibungslos: Solange die Fahrt reibungslos und sicher ist, kann das Auto schnell beschleunigen/verzögern.","Selten: nur wenn das Auto unbedingt muss.","Manchmal: Das Auto soll bei Bedarf bremsen. Das Auto sollte den richtigen Abstand zu den Autos um es herum halten, damit die Fahrt reibungslos verläuft.","Etwas Vertrauen","Etwas Vertrauen","Etwas Vertrauen","Neutral","Etwas Vertrauen","Etwas Vertrauen","Etwas Vertrauen","Etwas Vertrauen","Ich ziehe es vor, dass das selbstfahrende Auto eine Geschwindigkeit innerhalb von plus oder minus 10 km/h der Geschwindigkeitsbegrenzung beibehält.","Gelegentlich, wenn ein extrem langsames Fahrzeug überholt werden muss.","Reibungslos: Solange die Fahrt reibungslos und sicher ist, kann das Auto schnell beschleunigen/verzögern.","Selten: nur wenn das Auto unbedingt muss.","Reibungslos: Solange die Fahrt reibungslos und sicher ist, kann das Auto schnell beschleunigen/verzögern."
"2022/02/11 5:24:10 AM EST","Deutschland","Deutschland","23","Weiblich","Weiß","Mittlere Reife","Arbeitslos","No income","Single, nie verheiratet","Normalerweise fahre ich die Geschwindigkeitsbegrenzung (innerhalb von plus oder minus 10 km/h).","Ich signalisiere JEDE Bewegung (Sie verwenden Ihr Signal zu 100 %)","Ich wechsle die Spur nur, wenn es sein muss.","Sie planen voraus und wechseln die Spur jeweils um eine Spur, wenn Sie eine Öffnung sehen. Sie wechseln selten mehrere Fahrspuren gleichzeitig.","Sie beschleunigen und verlangsamen normalerweise in einem moderaten Tempo und kommen relativ schnell auf Geschwindigkeit. Sie halten selten an und die Passagiere fühlen sich beim Fahren nicht vorwärts oder rückwärts geschleudert.","Selten (Ich überhole Fahrzeuge nur, wenn es unbedingt sein muss)","Mittlere Distanz","Manchmal: Ich bremse, wenn es nötig ist, aber ich versuche, den richtigen Abstand zu den Autos um mich herum zu halten, damit ich nicht jedes Mal bremse, wenn der Verkehr langsamer wird.","Normalerweise fahre ich die Geschwindigkeitsbegrenzung (innerhalb von plus oder minus 10 km/h).","Ich signalisiere JEDE Bewegung (Sie verwenden Ihr Signal zu 100 %)","Ich wechsle gelegentlich die Spur, um ein extrem langsames Fahrzeug zu überholen.","Sie planen voraus und wechseln die Spur jeweils um eine Spur, wenn Sie eine Öffnung sehen. Sie wechseln selten mehrere Fahrspuren gleichzeitig.","Sie beschleunigen und verlangsamen normalerweise in einem moderaten Tempo und kommen relativ schnell auf Geschwindigkeit. Sie halten selten an und die Passagiere fühlen sich beim Fahren nicht vorwärts oder rückwärts geschleudert.","Oft (ich überhole andere Fahrzeuge in verschiedenen Situationen)","Fern","Manchmal: Ich bremse, wenn es nötig ist, aber ich versuche, den richtigen Abstand zu den Autos um mich herum zu halten, damit ich nicht jedes Mal bremse, wenn der Verkehr langsamer wird.","Mittlere Bahnen","Behalten Sie Ihre Geschwindigkeit bei, schließlich wird sich etwas öffnen. Ich plane im Voraus, wenn ich weiß, dass meine Ausfahrt in der Nähe ist, damit ich genügend Zeit habe, um den Spurwechsel vorzunehmen.","Ich bremse, um das Fahrzeug vor dem Abbiegen zu verlangsamen, und da meine Geschwindigkeit langsam genug ist, muss ich beim Abbiegen nicht oder nur sehr wenig bremsen.","Ich neige dazu, meine Geschwindigkeit zu reduzieren, um in Kurven auf der Straße nicht ständig auf die Bremse treten zu müssen.","Paralleles Parken","Regen","Insgesamt werde ich meine Geschwindigkeit verringern, aber es kann Momente geben, in denen ich vorübergehend schneller werde.","Mein Signalisierungsverhalten bleibt gleich.","Ich wechsle gelegentlich die Spur, um ein extrem langsames Fahrzeug zu überholen.","Fern","Ich fahre normalerweise nachts mit der Höchstgeschwindigkeit (10 km/h plus oder minus der Höchstgeschwindigkeit)","Ich signalisiere JEDE Bewegung (Sie verwenden Ihr Signal zu 100 %)","Ich wechsle gelegentlich die Spur, um ein extrem langsames Fahrzeug zu überholen.","Etwas Vertrauen","Neutral","Vertrauen","Etwas Vertrauen","Neutral","Vertrauen","Etwas Vertrauen","Vertrauen","Etwas Misstrauen","Etwas Vertrauen","Etwas Misstrauen","Etwas Vertrauen","Vertrauen","Etwas Vertrauen","Etwas Vertrauen","Ich ziehe es vor, dass das selbstfahrende Auto eine Geschwindigkeit innerhalb von plus oder minus 10 km/h der Geschwindigkeitsbegrenzung beibehält.","Gelegentlich, wenn ein extrem langsames Fahrzeug überholt werden muss.","Reibungslos: Solange die Fahrt reibungslos und sicher ist, kann das Auto schnell beschleunigen/verzögern.","Selten: nur wenn das Auto unbedingt muss.","Manchmal: Das Auto soll bei Bedarf bremsen. Das Auto sollte den richtigen Abstand zu den Autos um es herum halten, damit die Fahrt reibungslos verläuft.","Vertrauen","Etwas Vertrauen","Etwas Vertrauen","Neutral","Etwas Vertrauen","Vertrauen","Etwas Vertrauen","Etwas Vertrauen","Ich ziehe es vor, dass das selbstfahrende Auto eine Geschwindigkeit innerhalb von plus oder minus 10 km/h der Geschwindigkeitsbegrenzung beibehält.","Gelegentlich, wenn ein extrem langsames Fahrzeug überholt werden muss.","Reibungslos: Solange die Fahrt reibungslos und sicher ist, kann das Auto schnell beschleunigen/verzögern.","Manchmal: Ich möchte schnell an mein Ziel kommen, aber ich möchte, dass die Fahrt ruhig und stabil ist.","Reibungslos: Solange die Fahrt reibungslos und sicher ist, kann das Auto schnell beschleunigen/verzögern."
"2022/02/13 12:21:11 PM EST","Niederlande","Deutschland","20","Weiblich","Weiß","Bachelor-Abschluss","Beschäftigt","0€ < Einkommen<= 25.000€","Lebenspartner","Normalerweise fahre ich die Geschwindigkeitsbegrenzung (innerhalb von plus oder minus 10 km/h).","Ich signalisiere meine Bewegungen oft (Sie verwenden Ihr Signal 75 % der Zeit)","Ich wechsle gelegentlich die Spur, um ein extrem langsames Fahrzeug zu überholen.","Sie planen voraus und wechseln die Spur jeweils um eine Spur, wenn Sie eine Öffnung sehen. Sie wechseln selten mehrere Fahrspuren gleichzeitig.","Normalerweise beschleunigen und verlangsamen Sie langsam und es dauert eine Weile, bis Sie auf Geschwindigkeit kommen. Sie vermeiden einen kurzen Stopp.","Manchmal (ich überhole andere Fahrzeuge nur in wenigen Situationen)","Fern","Manchmal: Ich bremse, wenn es nötig ist, aber ich versuche, den richtigen Abstand zu den Autos um mich herum zu halten, damit ich nicht jedes Mal bremse, wenn der Verkehr langsamer wird.","Normalerweise fahre ich die Geschwindigkeitsbegrenzung (innerhalb von plus oder minus 10 km/h).","Ich signalisiere meine Bewegungen oft (Sie verwenden Ihr Signal 75 % der Zeit)","Ich wechsle gelegentlich die Spur, um ein extrem langsames Fahrzeug zu überholen.","Sie planen voraus und wechseln die Spur jeweils um eine Spur, wenn Sie eine Öffnung sehen. Sie wechseln selten mehrere Fahrspuren gleichzeitig.","Normalerweise beschleunigen und verlangsamen Sie langsam und es dauert eine Weile, bis Sie auf Geschwindigkeit kommen. Sie vermeiden kurze Stopps.","Manchmal (ich überhole andere Fahrzeuge nur in wenigen Situationen)","Fern","Manchmal: Ich bremse, wenn es nötig ist, aber ich versuche, den richtigen Abstand zu den Autos um mich herum zu halten, damit ich nicht jedes Mal bremse, wenn der Verkehr langsamer wird.","Mittlere Bahnen","Behalten Sie Ihre Geschwindigkeit bei, schließlich wird sich etwas öffnen. Ich plane im Voraus, wenn ich weiß, dass meine Ausfahrt in der Nähe ist, damit ich genügend Zeit habe, um den Spurwechsel vorzunehmen.","Ich halte meine aktuelle Geschwindigkeit und drücke während der Kurve auf die Bremse.","Ich neige dazu, meine Geschwindigkeit zu reduzieren, um in Kurven auf der Straße nicht ständig auf die Bremse treten zu müssen.","Parken an einer Steigung","das Glatteis","Ich werde meine Geschwindigkeit verringern, bis die Wetterbedingungen weg sind.","Ich neige dazu, weniger zu signalisieren, weil ich mich so darauf konzentriere, durch das schlechte Wetter zu fahren.","Ich wechsle die Spur nur, wenn es sein muss.","Fern","Ich fahre nachts normalerweise langsamer (10 km/h oder mehr UNTER der Geschwindigkeitsbegrenzung)","Ich signalisiere meine Bewegungen oft (Sie verwenden Ihr Signal 75 % der Zeit)","Ich wechsle gelegentlich die Spur, um ein extrem langsames Fahrzeug zu überholen.","Etwas Vertrauen","Etwas Misstrauen","Etwas Misstrauen","Neutral","Misstrauen","Etwas Misstrauen","Misstrauen","Etwas Misstrauen","Misstrauen","Etwas Vertrauen","Misstrauen","Neutral","Etwas Misstrauen","Etwas Vertrauen","Etwas Misstrauen","Ich ziehe es vor, dass das selbstfahrende Auto eine Geschwindigkeit innerhalb von plus oder minus 10 km/h der Geschwindigkeitsbegrenzung beibehält.","Gelegentlich, wenn ein extrem langsames Fahrzeug überholt werden muss.","Reibungslos: Solange die Fahrt reibungslos und sicher ist, kann das Auto schnell beschleunigen/verzögern.","Selten: nur wenn das Auto unbedingt muss.","Häufig: Wenn ich Bremslichter, etwas auf der Straße oder ein wahrgenommenes Risiko sehe, erwarte ich, dass das Auto reagiert, und das kann bedeuten, dass ich stark bremsen muss.","Misstrauen","Misstrauen","Neutral","Misstrauen","Misstrauen","Neutral","Etwas Vertrauen","Etwas Misstrauen","Ich ziehe es vor, dass das selbstfahrende Auto eine Geschwindigkeit innerhalb von plus oder minus 10 km/h der Geschwindigkeitsbegrenzung beibehält.","Nur wenn unbedingt nötig","Reibungslos: Solange die Fahrt reibungslos und sicher ist, kann das Auto schnell beschleunigen/verzögern.","Selten: nur wenn das Auto unbedingt muss.","Reibungslos: Solange die Fahrt reibungslos und sicher ist, kann das Auto schnell beschleunigen/verzögern."
