"Timestamp","1. In welchem ​​Land leben Sie derzeit?","2. In welchem ​​Land bist du am meisten gefahren?","3. Wie alt bist du?","4. Was ist dein Geschlecht?","5. Was ist Ihre ethnische Herkunft/Rasse?","6. Was hast du für eine Ausbildung?","7. Was ist Ihr Beschäftigungsstatus?","8. Was ist Ihre Einkommensspanne?","9. Wie ist Ihr Familienstand","10. Was Ihr Fahrverhalten in Bezug auf die Geschwindigkeit während der Fahrt am besten beschreibt: NICHT-AUTOBAHNSTRASSEN","11. Was Ihr Verhalten meistens am besten beschreibt, wenn es darum geht, Spurwechsel während der Fahrt zu signalisieren: NICHT-AUTOBAHNSTRASSEN","12. Was Ihr Spurwechselverhalten beim Weiterfahren am besten beschreibt: NICHT-AUTOBAHNSTRASSEN","13. Wenn Sie die Fahrspur auf einer Straße ändern möchten, die keine Autobahn ist, und auf eine Fahrspur wechseln möchten, die 2 oder mehr Fahrspuren entfernt ist","14. Wie würden Sie die Art und Weise beschreiben, wie Sie während der Fahrt beschleunigen und abbremsen: NICHT-AUTOBAHNSTRASSEN","15. Wie oft überholen Sie andere Fahrzeuge beim Fahren auf: NICHT-AUTOBAHNSTRASSEN","16. Welchen Abstand halten Sie normalerweise zum vorausfahrenden Auto, wenn Sie auf folgenden Straßen fahren: NICHT AUTOBAHNSTRASSEN","17. Was Ihr Bremsverhalten beim Weiterfahren am besten beschreibt: NICHT-AUTOBAHNSTRASSEN","18. Was Ihr Fahrverhalten in Bezug auf die Geschwindigkeit während der Fahrt meist am besten beschreibt: DIE AUTOBAHN","19. Was Ihr Verhalten beim Spurwechsel während der Fahrt meistens am besten beschreibt: DIE AUTOBAHN","20. Was Ihr Spurwechselverhalten beim Fahren am besten beschreibt: DIE AUTOBAHN","21. Wenn Sie auf der AUTOBAHN die Spur wechseln und auf eine Spur wechseln möchten, die 2 oder mehr Spuren entfernt ist","22. Wie würden Sie das Beschleunigen und Abbremsen während der Fahrt beschreiben: DIE AUTOBAHN","23. Wie oft überholen Sie andere Fahrzeuge beim Fahren auf: DER AUTOBAHN","24. Welchen Abstand halten Sie normalerweise zum Vordermann, wenn Sie auf der AUTOBAHN fahren","25. Was Ihr Bremsverhalten beim Fahren am besten beschreibt: DIE AUTOBAHN","26. Wenn Sie auf einer Autobahn mit mehr als 2 Fahrspuren fahren, welche Fahrspur bevorzugen Sie?","27. Sie müssen die Spur wechseln, um zur Autobahn zu gelangen, aber die Stelle, an die Sie wechseln wollten, ist nicht groß genug. Wie geht's?","28. Was beschreibt Ihr Fahrverhalten beim Abbiegen am besten?","29. Was beschreibt Ihr Fahrverhalten beim Fahren auf einer kurvenreichen Straße am besten?","30. Welche Art des Parkens finden Sie am schwierigsten?","31. In welcher weniger als perfekten Wettersituation fahren Sie am häufigsten?","32. Was passiert mit Ihrer Geschwindigkeit, wenn Sie bei diesen nicht perfekten Wetterbedingungen fahren?","33. Was passiert mit Ihrem Signalverhalten, wenn Sie bei diesen nicht perfekten Wetterbedingungen fahren?","34. Wie würden Sie Ihr Spurwechselverhalten beim Fahren bei diesen nicht perfekten Wetterbedingungen beschreiben?","35. Wenn Sie bei diesen nicht perfekten Wetterbedingungen fahren, welchen Abstand halten Sie am liebsten zum vorausfahrenden Auto?","36. Was beschreibt am besten Ihr Fahrverhalten in Bezug auf Geschwindigkeit bei Nachtfahrten?","37. Was beschreibt Ihr Verhalten meistens am besten, wenn es darum geht, bei Nachtfahrten den Spurwechsel zu signalisieren:","38. Was beschreibt am besten Ihr Spurwechselverhalten bei Nachtfahrten?","39. Wie hoch ist Ihr Vertrauen in die Nutzung künstlicher Intelligenz oder vollständig autonomer Technologien?","40. Wie hoch ist Ihr Vertrauen in die Nutzung eines selbstfahrenden Autos, wenn diese Technologie verfügbar wird?","41. Wie groß ist Ihr Vertrauen, dass selbstfahrende Autos Ihre eigene Sicherheit als oberstes Ziel behalten werden?","42. Wie groß ist Ihr Vertrauen, dass selbstfahrende Autos in Baustellen mit vorübergehenden Umleitungen navigieren können, die normalerweise gegen den Verkehrsfluss verlaufen würden?","43. Wie hoch ist Ihr Vertrauen, dass selbstfahrende Autos in überfüllten Fußgängerzonen navigieren können?","44. Wie hoch ist Ihr Vertrauen, dass selbstfahrende Autos Sie erfolgreich an das von Ihnen gewünschte GENAUE Ziel bringen werden?","45. Wie hoch ist Ihr Vertrauen in die Fähigkeit selbstfahrender Autos, sicher zu navigieren, ohne dass sich eine Person im Fahrzeug befindet?","46. Wenn Sie in einem selbstfahrenden Auto säßen, welche Aufgaben würden Sie gerne an das Auto übergeben, um es autonom auszuführen? Bitte stufen Sie Ihre Vertrauensstufe ein, wenn es um die folgenden Fahraufgaben geht, die von einem selbstfahrenden Auto beim Befahren ausgeführt werden: NICHT-AUTOBAHNSTRASSEN [Die Geschwindigkeit des Autos]","46. Wenn Sie in einem selbstfahrenden Auto säßen, welche Aufgaben würden Sie gerne an das Auto übergeben, um es autonom auszuführen? Bitte stufen Sie Ihre Vertrauensstufe ein, wenn es um die folgenden Fahraufgaben geht, die von einem selbstfahrenden Auto beim Befahren ausgeführt werden: NICHT-AUTOBAHNSTRASSEN [Spurwechsel]","46. Wenn Sie in einem selbstfahrenden Auto säßen, welche Aufgaben würden Sie gerne an das Auto übergeben, um es autonom auszuführen? Bitte stufen Sie Ihre Vertrauensstufe ein, wenn es um die folgenden Fahraufgaben geht, die von einem selbstfahrenden Auto beim Befahren ausgeführt werden: NICHT-AUTOBAHNSTRASSEN [Signalisierung]","46. Wenn Sie in einem selbstfahrenden Auto säßen, welche Aufgaben würden Sie gerne an das Auto übergeben, um es autonom auszuführen? Bitte stufen Sie Ihre Vertrauensstufe ein, wenn es um die folgenden Fahraufgaben geht, die von einem selbstfahrenden Auto beim Befahren ausgeführt werden: NICHT-AUTOBAHNSTRASSEN [Fahren bei gefährlichen Wetterbedingungen]","46. Wenn Sie in einem selbstfahrenden Auto säßen, welche Aufgaben würden Sie gerne an das Auto übergeben, um es autonom auszuführen? Bitte stufen Sie Ihre Vertrauensstufe ein, wenn es um die folgenden Fahraufgaben geht, die von einem selbstfahrenden Auto beim Befahren ausgeführt werden: NICHT-AUTOBAHNSTRASSEN [Bremsen]","46. Wenn Sie in einem selbstfahrenden Auto säßen, welche Aufgaben würden Sie gerne an das Auto übergeben, um es autonom auszuführen? Bitte stufen Sie Ihre Vertrauensstufe ein, wenn es um die folgenden Fahraufgaben geht, die von einem selbstfahrenden Auto beim Befahren ausgeführt werden: NICHT-AUTOBAHNSTRASSEN [Halten Sie einen gewissen Abstand zu den Autos um Sie herum]","46. Wenn Sie in einem selbstfahrenden Auto säßen, welche Aufgaben würden Sie gerne an das Auto übergeben, um es autonom auszuführen? Bitte stufen Sie Ihre Vertrauensstufe ein, wenn es um die folgenden Fahraufgaben geht, die von einem selbstfahrenden Auto beim Befahren ausgeführt werden: NICHT-AUTOBAHNSTRASSEN [Parken]","46. Wenn Sie in einem selbstfahrenden Auto säßen, welche Aufgaben würden Sie gerne an das Auto übergeben, um es autonom auszuführen? Bitte stufen Sie Ihre Vertrauensstufe ein, wenn es um die folgenden Fahraufgaben geht, die von einem selbstfahrenden Auto beim Befahren ausgeführt werden: NICHT-AUTOBAHNSTRASSEN [Nachts fahren]","47. Wenn Sie in einem selbstfahrenden Auto unterwegs sind und das Auto die Kontrolle über die Geschwindigkeit hat, mit welchem ​​Geschwindigkeitsbereich würden Sie sich beim Fahren am wohlsten fühlen: NICHT-AUTOBAHNSTRASSEN","48. Wenn Sie in einem selbstfahrenden Auto unterwegs sind, erwarten Sie auf NICHT-AUTOBAHNSTRASSEN, dass das Auto die Spur wechselt:","49. Wenn Sie in einem selbstfahrenden Auto auf NICHT-HAUPTSTRASSEN unterwegs sind, wäre Ihre Präferenz für die Art und Weise, wie es beschleunigt und verzögert, wie folgt:","50. Wenn Sie in einem selbstfahrenden Auto unterwegs sind, wie oft würden Sie damit rechnen, dass das Auto andere Fahrzeuge überholt, wenn Sie auf folgenden Straßen fahren: NICHT AUTOBAHNSTRASSEN","51. Wenn Sie in einem selbstfahrenden Auto unterwegs sind, wie oft möchten Sie, dass das Auto beim Fahren auf folgenden Straßen bremst?","52. Wenn Sie in einem selbstfahrenden Auto säßen, welche Aufgaben würden Sie gerne an das Auto übergeben, um es autonom auszuführen? Bitte stufen Sie Ihr Vertrauen ein, wenn es um die folgenden Fahraufgaben geht, die von einem selbstfahrenden Auto beim Fahren auf Autobahnen ausgeführt werden: AUTOBAHNEN [Die Geschwindigkeit des Autos]","52. Wenn Sie in einem selbstfahrenden Auto säßen, welche Aufgaben würden Sie gerne an das Auto übergeben, um es autonom auszuführen? Bitte stufen Sie Ihr Vertrauen ein, wenn es um die folgenden Fahraufgaben geht, die von einem selbstfahrenden Auto beim Fahren auf Autobahnen ausgeführt werden: AUTOBAHNEN [Spurwechsel]","52. Wenn Sie in einem selbstfahrenden Auto säßen, welche Aufgaben würden Sie gerne an das Auto übergeben, um es autonom auszuführen? Bitte stufen Sie Ihr Vertrauen ein, wenn es um die folgenden Fahraufgaben geht, die von einem selbstfahrenden Auto beim Fahren auf Autobahnen ausgeführt werden: AUTOBAHNEN [Signalisierung]","52. Wenn Sie in einem selbstfahrenden Auto säßen, welche Aufgaben würden Sie gerne an das Auto übergeben, um es autonom auszuführen? Bitte stufen Sie Ihr Vertrauen ein, wenn es um die folgenden Fahraufgaben geht, die von einem selbstfahrenden Auto beim Fahren auf Autobahnen ausgeführt werden: AUTOBAHNEN [Fahren bei gefährlichen Wetterbedingungen]","52. Wenn Sie in einem selbstfahrenden Auto säßen, welche Aufgaben würden Sie gerne an das Auto übergeben, um es autonom auszuführen? Bitte stufen Sie Ihr Vertrauen ein, wenn es um die folgenden Fahraufgaben geht, die von einem selbstfahrenden Auto beim Fahren auf Autobahnen ausgeführt werden: AUTOBAHNEN [Bremsen]","52. Wenn Sie in einem selbstfahrenden Auto säßen, welche Aufgaben würden Sie gerne an das Auto übergeben, um es autonom auszuführen? Bitte stufen Sie Ihr Vertrauen ein, wenn es um die folgenden Fahraufgaben geht, die von einem selbstfahrenden Auto beim Fahren auf Autobahnen ausgeführt werden: AUTOBAHNEN [Halten Sie einen gewissen Abstand zu den Autos um Sie herum]","52. Wenn Sie in einem selbstfahrenden Auto säßen, welche Aufgaben würden Sie gerne an das Auto übergeben, um es autonom auszuführen? Bitte stufen Sie Ihr Vertrauen ein, wenn es um die folgenden Fahraufgaben geht, die von einem selbstfahrenden Auto beim Fahren auf Autobahnen ausgeführt werden: AUTOBAHNEN [Parken]","52. Wenn Sie in einem selbstfahrenden Auto säßen, welche Aufgaben würden Sie gerne an das Auto übergeben, um es autonom auszuführen? Bitte stufen Sie Ihr Vertrauen ein, wenn es um die folgenden Fahraufgaben geht, die von einem selbstfahrenden Auto beim Fahren auf Autobahnen ausgeführt werden: AUTOBAHNEN [Nachts fahren]","53. Wenn Sie in einem selbstfahrenden Auto unterwegs sind und das Auto die Kontrolle über die Geschwindigkeit hat, mit welcher Bereichsgeschwindigkeit würden Sie sich beim Fahren am wohlsten fühlen: AUTOBAHNSTRASSEN","54. Wenn Sie in einem selbstfahrenden Auto auf AUTOBAHNEN unterwegs sind, erwarten Sie, dass das Auto die Spur wechselt:","55. Wenn Sie in einem selbstfahrenden Auto auf Autobahnen unterwegs sind, bevorzugen Sie die Art und Weise, wie es beschleunigt und verzögert, wie folgt:","56. Wenn Sie in einem selbstfahrenden Auto unterwegs sind, wie oft würden Sie erwarten, dass das Auto andere Fahrzeuge überholt, wenn Sie auf: AUTOBAHNSTRASSEN fahren","57. Wenn Sie in einem selbstfahrenden Auto unterwegs sind, wie oft möchten Sie, dass das Auto beim Fahren auf Autobahnen bremst"
"2022/01/20 2:37:49 AM EST","Deutschland","Deutschland","23","Männlich","Weiß","MD/Andere Berufsabschlüsse","Beschäftigt","0€ < Einkommen<= 25.000€","Single, nie verheiratet","Ich fahre normalerweise über dem Tempolimit (mehr als 10 km/h ÜBER dem Tempolimit).","Ich signalisiere JEDE Bewegung (Sie verwenden Ihr Signal zu 100 %)","Ich wechsle gelegentlich die Spur, um ein extrem langsames Fahrzeug zu überholen.","Manchmal wechseln Sie mehrere Fahrspuren gleichzeitig und manchmal planen Sie im Voraus und wechseln die Fahrspuren jeweils eine Spur nach der anderen.","Normalerweise beschleunigen und verlangsamen Sie langsam und es dauert eine Weile, bis Sie auf Geschwindigkeit kommen. Sie vermeiden einen kurzen Stopp.","Selten (Ich überhole Fahrzeuge nur, wenn es unbedingt sein muss)","Mittlere Distanz","Manchmal: Ich bremse, wenn es nötig ist, aber ich versuche, den richtigen Abstand zu den Autos um mich herum zu halten, damit ich nicht jedes Mal bremse, wenn der Verkehr langsamer wird.","Ich fahre normalerweise über dem Tempolimit (mehr als 10 km/h ÜBER dem Tempolimit).","Ich signalisiere JEDE Bewegung (Sie verwenden Ihr Signal zu 100 %)","Ich wechsle gelegentlich die Spur, um ein extrem langsames Fahrzeug zu überholen.","Manchmal wechseln Sie mehrere Fahrspuren gleichzeitig und manchmal planen Sie im Voraus und wechseln die Fahrspuren jeweils eine Spur nach der anderen.","Normalerweise beschleunigen und verlangsamen Sie langsam und es dauert eine Weile, bis Sie auf Geschwindigkeit kommen. Sie vermeiden kurze Stopps.","Oft (ich überhole andere Fahrzeuge in verschiedenen Situationen)","Fern","Selten: Ich bremse nur, wenn es sein muss, zum Beispiel bei Stau oder Einsatzfahrzeugen. Wenn ich das Bremsen durch einen Spurwechsel vermeiden kann, werde ich die Spur wechseln.","Die rechte Spur","Behalten Sie Ihre Geschwindigkeit bei, schließlich wird sich etwas öffnen. Ich plane im Voraus, wenn ich weiß, dass meine Ausfahrt in der Nähe ist, damit ich genügend Zeit habe, um den Spurwechsel vorzunehmen.","Ich halte meine aktuelle Geschwindigkeit und drücke während der Kurve auf die Bremse.","Ich neige dazu, meine Geschwindigkeit zu reduzieren, um in Kurven auf der Straße nicht ständig auf die Bremse treten zu müssen.","Senkrechtes Parken","Regen","Insgesamt werde ich meine Geschwindigkeit verringern, aber es kann Momente geben, in denen ich vorübergehend schneller werde.","Mein Signalisierungsverhalten bleibt gleich.","Ich wechsle gelegentlich die Spur, um ein extrem langsames Fahrzeug zu überholen.","Fern","Ich fahre nachts normalerweise schneller (10 km/h oder mehr ÜBER der Geschwindigkeitsbegrenzung)","Ich signalisiere meine Bewegungen oft (Sie verwenden Ihr Signal 75 % der Zeit)","Ich wechsle gelegentlich die Spur, um ein extrem langsames Fahrzeug zu überholen.","Vertrauen","Vertrauen","Vertrauen","Vertrauen","Etwas Vertrauen","Vertrauen","Etwas Vertrauen","Vertrauen","Etwas Vertrauen","Etwas Vertrauen","Etwas Vertrauen","Etwas Vertrauen","Etwas Vertrauen","Etwas Vertrauen","Vertrauen","Ich ziehe es vor, dass das selbstfahrende Auto eine Geschwindigkeit innerhalb von plus oder minus 10 km/h der Geschwindigkeitsbegrenzung beibehält.","Nur wenn unbedingt nötig","Reibungslos: Solange die Fahrt reibungslos und sicher ist, kann das Auto schnell beschleunigen/verzögern.","Selten: nur wenn das Auto unbedingt muss.","Häufig: Wenn ich Bremslichter, etwas auf der Straße oder ein wahrgenommenes Risiko sehe, erwarte ich, dass das Auto reagiert, und das kann bedeuten, dass ich stark bremsen muss.","Vertrauen","Vertrauen","Vertrauen","Etwas Vertrauen","Etwas Vertrauen","Etwas Vertrauen","Vertrauen","Vertrauen","Ich ziehe es vor, dass das selbstfahrende Auto eine Geschwindigkeit innerhalb von plus oder minus 10 km/h der Geschwindigkeitsbegrenzung beibehält.","Gelegentlich, wenn ein extrem langsames Fahrzeug überholt werden muss.","Reibungslos: Solange die Fahrt reibungslos und sicher ist, kann das Auto schnell beschleunigen/verzögern.","Manchmal: Ich möchte schnell an mein Ziel kommen, aber ich möchte, dass die Fahrt ruhig und stabil ist.","Reibungslos: Solange die Fahrt reibungslos und sicher ist, kann das Auto schnell beschleunigen/verzögern."
"2022/01/20 8:02:10 AM EST","Österreich","Luxemburg","29","Weiblich","Weiß","Bachelor-Abschluss","Beschäftigt","0€ < Einkommen<= 25.000€","Single, nie verheiratet","Normalerweise fahre ich die Geschwindigkeitsbegrenzung (innerhalb von plus oder minus 10 km/h).","Ich signalisiere JEDE Bewegung (Sie verwenden Ihr Signal zu 100 %)","Ich wechsle die Spur nur, wenn es sein muss.","Manchmal wechseln Sie mehrere Fahrspuren gleichzeitig und manchmal planen Sie im Voraus und wechseln die Fahrspuren jeweils eine Spur nach der anderen.","Sie beschleunigen und verlangsamen normalerweise in einem moderaten Tempo und kommen relativ schnell auf Geschwindigkeit. Sie halten selten an und die Passagiere fühlen sich beim Fahren nicht vorwärts oder rückwärts geschleudert.","Manchmal (ich überhole andere Fahrzeuge nur in wenigen Situationen)","Mittlere Distanz","Manchmal: Ich bremse, wenn es nötig ist, aber ich versuche, den richtigen Abstand zu den Autos um mich herum zu halten, damit ich nicht jedes Mal bremse, wenn der Verkehr langsamer wird.","Ich fahre normalerweise über dem Tempolimit (mehr als 10 km/h ÜBER dem Tempolimit).","Ich signalisiere meine Bewegungen oft (Sie verwenden Ihr Signal 75 % der Zeit)","Ich wechsle häufig die Spur, um auf der schnellstmöglichen Spur zu sein.","Sie wechseln häufig alle Fahrspuren auf einmal. (Dies kann bedeuten, dass 2 oder mehr Fahrspuren gleichzeitig gewechselt werden)","Sie beschleunigen und verlangsamen normalerweise in einem moderaten Tempo und kommen relativ schnell auf Geschwindigkeit. Sie halten selten an und die Passagiere fühlen sich beim Fahren nicht vorwärts oder rückwärts geschleudert.","Oft (ich überhole andere Fahrzeuge in verschiedenen Situationen)","Fern","Manchmal: Ich bremse, wenn es nötig ist, aber ich versuche, den richtigen Abstand zu den Autos um mich herum zu halten, damit ich nicht jedes Mal bremse, wenn der Verkehr langsamer wird.","Mittlere Bahnen","Behalten Sie Ihre Geschwindigkeit bei, schließlich wird sich etwas öffnen. Ich plane im Voraus, wenn ich weiß, dass meine Ausfahrt in der Nähe ist, damit ich genügend Zeit habe, um den Spurwechsel vorzunehmen.","Ich bremse, um das Fahrzeug vor dem Abbiegen zu verlangsamen, und da meine Geschwindigkeit langsam genug ist, muss ich beim Abbiegen nicht oder nur sehr wenig bremsen.","Ich neige dazu, meine Geschwindigkeit zu reduzieren, um in Kurven auf der Straße nicht ständig auf die Bremse treten zu müssen.","Parken an einer Steigung","Regen","Ich werde meine Geschwindigkeit verringern, bis die Wetterbedingungen weg sind.","Mein Signalisierungsverhalten bleibt gleich.","Ich wechsle die Spur nur, wenn es sein muss.","Mittlere Distanz","Ich fahre normalerweise nachts mit der Höchstgeschwindigkeit (10 km/h plus oder minus der Höchstgeschwindigkeit)","Ich signalisiere JEDE Bewegung (Sie verwenden Ihr Signal zu 100 %)","Ich wechsle gelegentlich die Spur, um ein extrem langsames Fahrzeug zu überholen.","Etwas Misstrauen","Etwas Misstrauen","Etwas Misstrauen","Etwas Misstrauen","Etwas Misstrauen","Etwas Misstrauen","Etwas Misstrauen","Etwas Misstrauen","Etwas Misstrauen","Etwas Vertrauen","Etwas Misstrauen","Etwas Misstrauen","Etwas Vertrauen","Etwas Misstrauen","Etwas Misstrauen","Ich ziehe es vor, dass das selbstfahrende Auto eine Geschwindigkeit innerhalb von plus oder minus 10 km/h der Geschwindigkeitsbegrenzung beibehält.","Gelegentlich, wenn ein extrem langsames Fahrzeug überholt werden muss.","Reibungslos: Solange die Fahrt reibungslos und sicher ist, kann das Auto schnell beschleunigen/verzögern.","Selten: nur wenn das Auto unbedingt muss.","Manchmal: Das Auto soll bei Bedarf bremsen. Das Auto sollte den richtigen Abstand zu den Autos um es herum halten, damit die Fahrt reibungslos verläuft.","Etwas Misstrauen","Etwas Misstrauen","Etwas Vertrauen","Etwas Misstrauen","Etwas Misstrauen","Etwas Vertrauen","Etwas Misstrauen","Etwas Misstrauen","Ich ziehe es vor, dass das selbstfahrende Auto eine Geschwindigkeit innerhalb von plus oder minus 10 km/h der Geschwindigkeitsbegrenzung beibehält.","Gelegentlich, wenn ein extrem langsames Fahrzeug überholt werden muss.","Reibungslos: Solange die Fahrt reibungslos und sicher ist, kann das Auto schnell beschleunigen/verzögern.","Manchmal: Ich möchte schnell an mein Ziel kommen, aber ich möchte, dass die Fahrt ruhig und stabil ist.","Reibungslos: Solange die Fahrt reibungslos und sicher ist, kann das Auto schnell beschleunigen/verzögern."
"2022/01/25 5:57:17 AM EST","Deutschland","Deutschland","37","Männlich","Weiß","Bachelor-Abschluss","Selbstständiger","50.000€ < Einkommen <= 100.000€","Lebenspartner","Normalerweise fahre ich die Geschwindigkeitsbegrenzung (innerhalb von plus oder minus 10 km/h).","Ich signalisiere JEDE Bewegung (Sie verwenden Ihr Signal zu 100 %)","Ich wechsle häufig die Spur, um auf der schnellstmöglichen Spur zu sein.","Sie planen voraus und wechseln die Spur jeweils um eine Spur, wenn Sie eine Öffnung sehen. Sie wechseln selten mehrere Fahrspuren gleichzeitig.","Sie beschleunigen und verlangsamen normalerweise in einem moderaten Tempo und kommen relativ schnell auf Geschwindigkeit. Sie halten selten an und die Passagiere fühlen sich beim Fahren nicht vorwärts oder rückwärts geschleudert.","Oft (ich überhole andere Fahrzeuge in verschiedenen Situationen)","Mittlere Distanz","Manchmal: Ich bremse, wenn es nötig ist, aber ich versuche, den richtigen Abstand zu den Autos um mich herum zu halten, damit ich nicht jedes Mal bremse, wenn der Verkehr langsamer wird.","Normalerweise fahre ich die Geschwindigkeitsbegrenzung (innerhalb von plus oder minus 10 km/h).","Ich signalisiere JEDE Bewegung (Sie verwenden Ihr Signal zu 100 %)","Ich wechsle häufig die Spur, um auf der schnellstmöglichen Spur zu sein.","Sie planen voraus und wechseln die Spur jeweils um eine Spur, wenn Sie eine Öffnung sehen. Sie wechseln selten mehrere Fahrspuren gleichzeitig.","Sie beschleunigen und verlangsamen normalerweise in einem moderaten Tempo und kommen relativ schnell auf Geschwindigkeit. Sie halten selten an und die Passagiere fühlen sich beim Fahren nicht vorwärts oder rückwärts geschleudert.","Oft (ich überhole andere Fahrzeuge in verschiedenen Situationen)","Fern","Manchmal: Ich bremse, wenn es nötig ist, aber ich versuche, den richtigen Abstand zu den Autos um mich herum zu halten, damit ich nicht jedes Mal bremse, wenn der Verkehr langsamer wird.","Mittlere Bahnen","Verlangsamen Sie und versuchen Sie, einen anderen Platz dahinter zu finden.","Ich bremse, um das Fahrzeug vor dem Abbiegen zu verlangsamen, und da meine Geschwindigkeit langsam genug ist, muss ich beim Abbiegen nicht oder nur sehr wenig bremsen.","Ich neige dazu, meine Geschwindigkeit zu reduzieren, um in Kurven auf der Straße nicht ständig auf die Bremse treten zu müssen.","Parken an einer Steigung","Nebel","Ich werde meine Geschwindigkeit verringern, bis die Wetterbedingungen weg sind.","Mein Signalisierungsverhalten bleibt gleich.","Ich wechsle gelegentlich die Spur, um ein extrem langsames Fahrzeug zu überholen.","Fern","Ich fahre nachts normalerweise langsamer (10 km/h oder mehr UNTER der Geschwindigkeitsbegrenzung)","Ich signalisiere JEDE Bewegung (Sie verwenden Ihr Signal zu 100 %)","Ich wechsle gelegentlich die Spur, um ein extrem langsames Fahrzeug zu überholen.","Neutral","Neutral","Etwas Vertrauen","Neutral","Misstrauen","Etwas Vertrauen","Neutral","Neutral","Etwas Misstrauen","Vertrauen","Etwas Vertrauen","Etwas Vertrauen","Vertrauen","Etwas Vertrauen","Etwas Vertrauen","Ich ziehe es vor, dass das selbstfahrende Auto eine Geschwindigkeit innerhalb von plus oder minus 10 km/h der Geschwindigkeitsbegrenzung beibehält.","Gelegentlich, wenn ein extrem langsames Fahrzeug überholt werden muss.","Reibungslos: Solange die Fahrt reibungslos und sicher ist, kann das Auto schnell beschleunigen/verzögern.","Manchmal: Ich möchte schnell an mein Ziel kommen, aber ich möchte, dass die Fahrt ruhig und stabil ist.","Manchmal: Das Auto soll bei Bedarf bremsen. Das Auto sollte den richtigen Abstand zu den Autos um es herum halten, damit die Fahrt reibungslos verläuft.","Etwas Vertrauen","Etwas Vertrauen","Vertrauen","Etwas Vertrauen","Etwas Vertrauen","Etwas Vertrauen","Etwas Vertrauen","Etwas Vertrauen","Ich ziehe es vor, dass das selbstfahrende Auto eine Geschwindigkeit innerhalb von plus oder minus 10 km/h der Geschwindigkeitsbegrenzung beibehält.","Gelegentlich, wenn ein extrem langsames Fahrzeug überholt werden muss.","Reibungslos: Solange die Fahrt reibungslos und sicher ist, kann das Auto schnell beschleunigen/verzögern.","Manchmal: Ich möchte schnell an mein Ziel kommen, aber ich möchte, dass die Fahrt ruhig und stabil ist.","Reibungslos: Solange die Fahrt reibungslos und sicher ist, kann das Auto schnell beschleunigen/verzögern."
